{
  "$schema": "https://json-schema.org/draft/2020-12/schema",
  "$id": "review/vendor-collectible-registry-summary.schema.json",
  "type": "object",
  "additionalProperties": false,
  "required": ["registry_id", "snapshot_id", "source_id", "vendor_item_count", "collectible_type_count", "collectible_types", "collectible_record_count", "excluded_non_collectible_count", "link_status_counts", "canonical_link_count", "candidate_link_count", "unresolved_count", "name_cluster_count", "cross_type_conflict_cluster_count", "cross_type_conflict_collectible_cluster_count", "cross_type_conflict_collectible_record_count", "canonical_write", "model_feature_status", "notes"],
  "properties": {
    "registry_id": {"const": "vendor_skygame_data_1_3_4_collectible_registry"},
    "snapshot_id": {"const": "vendor_skygame_data_1_3_4"},
    "source_id": {"const": "source_skygame_data_1_3_4"},
    "vendor_item_count": {"const": 3266},
    "collectible_type_count": {"const": 17},
    "collectible_types": {"type": "array", "minItems": 17, "maxItems": 17, "uniqueItems": true, "items": {"type": "string", "minLength": 1}},
    "collectible_record_count": {"const": 1758},
    "excluded_non_collectible_count": {"const": 1508},
    "link_status_counts": {"type": "object", "additionalProperties": false, "required": ["canonical_link", "candidate_link", "unresolved"], "properties": {"canonical_link": {"const": 64}, "candidate_link": {"const": 296}, "unresolved": {"const": 1398}}},
    "canonical_link_count": {"const": 64},
    "candidate_link_count": {"const": 296},
    "unresolved_count": {"const": 1398},
    "name_cluster_count": {"type": "integer", "minimum": 1},
    "cross_type_conflict_cluster_count": {"const": 16},
    "cross_type_conflict_collectible_cluster_count": {"const": 11},
    "cross_type_conflict_collectible_record_count": {"const": 26},
    "canonical_write": {"const": "not_performed"},
    "model_feature_status": {"const": "excluded_pending_verification"},
    "notes": {"type": "string", "minLength": 1}
  }
}
