{"candidate_link_count":296,"canonical_link_count":64,"canonical_write":"not_performed","collectible_record_count":1758,"collectible_type_count":17,"collectible_types":["Call","Cape","Emote","FaceAccessory","Furniture","Hair","HairAccessory","HeadAccessory","Held","Mask","Music","Necklace","Outfit","OutfitShoes","Prop","Shoes","Stance"],"cross_type_conflict_cluster_count":16,"cross_type_conflict_collectible_cluster_count":11,"cross_type_conflict_collectible_record_count":26,"excluded_non_collectible_count":1508,"link_status_counts":{"candidate_link":296,"canonical_link":64,"unresolved":1398},"model_feature_status":"excluded_pending_verification","name_cluster_count":1480,"notes":"Collectible records are review-only. Exact-name links inherit the existing crosswalk and are not identity confirmation. Name clusters include all vendor types; cross-type clusters are quarantined. Excluded non-collectible rows are represented only by this summary.","registry_id":"vendor_skygame_data_1_3_4_collectible_registry","snapshot_id":"vendor_skygame_data_1_3_4","source_id":"source_skygame_data_1_3_4","unresolved_count":1398,"vendor_item_count":3266}
